{
  "schema": 1,
  "seq": 0,
  "written_at": 1791590400000,
  "summary": {
    "state": "attention",
    "needs_action": true,
    "line": "eGPU detected (amdgpu) · not supported yet"
  },
  "phase": "bound",
  "bolt": {
    "present": true,
    "daemon": true,
    "domain": true,
    "uuid": "aaaaaaaa-0000-0000-0000-000000000002",
    "name": "Core X",
    "vendor": "Razer",
    "status": "authorized",
    "policy": "iommu",
    "stored": true,
    "generation": "USB4",
    "profile": "generic"
  },
  "pci": {
    "present": true,
    "bdf": "0000:05:00.0",
    "functions": [
      "0000:05:00.0"
    ],
    "vendor": "0x1002",
    "device": "0x744c",
    "name": "Advanced Micro Devices, Inc. [AMD/ATI] Navi 31 [Radeon RX 7900 XT/7900 XTX]",
    "removable": true,
    "link": {
      "speed": "8.0 GT/s PCIe",
      "width": "4",
      "max_speed": "16.0 GT/s PCIe",
      "max_width": "16"
    }
  },
  "backend": {
    "name": "amdgpu",
    "supported": false
  },
  "driver": {
    "bound": "amdgpu",
    "modules": {},
    "modeset": null,
    "fbdev": null
  },
  "gpu": {
    "ok": false,
    "name": null,
    "version": null,
    "temp_c": null,
    "util_pct": null,
    "mem_used_mb": null,
    "procs": [],
    "error": "backend_stub"
  },
  "drm": {
    "card": null,
    "card_bypath": null,
    "link": null,
    "compositor_has_card": false
  },
  "display": {
    "monitors": [],
    "needs_relogin": false
  },
  "modules": {
    "held_after_eject": false
  },
  "steam": {
    "running": false
  },
  "hints": [],
  "health_summary": {
    "errors": 0,
    "warnings": 1
  },
  "last_event": null,
  "recent_events": []
}
