{
  "schema": 1,
  "seq": 0,
  "written_at": 1791590400000,
  "summary": {
    "state": "absent",
    "needs_action": false,
    "line": "No eGPU"
  },
  "phase": "absent",
  "bolt": {
    "present": false,
    "daemon": false,
    "domain": false,
    "uuid": null,
    "name": null,
    "vendor": null,
    "status": null,
    "policy": null,
    "stored": false,
    "generation": null,
    "profile": null
  },
  "pci": {
    "present": false,
    "bdf": null,
    "functions": [],
    "vendor": null,
    "device": null,
    "name": null,
    "removable": false,
    "link": null
  },
  "backend": {
    "name": null,
    "supported": false
  },
  "driver": {
    "bound": null,
    "modules": {},
    "modeset": null,
    "fbdev": null
  },
  "gpu": {
    "ok": false,
    "name": null,
    "version": null,
    "temp_c": null,
    "util_pct": null,
    "mem_used_mb": null,
    "procs": []
  },
  "drm": {
    "card": null,
    "card_bypath": null,
    "link": null,
    "compositor_has_card": null
  },
  "display": {
    "monitors": [],
    "needs_relogin": false
  },
  "modules": {
    "held_after_eject": false
  },
  "steam": {
    "running": false
  },
  "hints": [],
  "health_summary": {
    "errors": 3,
    "warnings": 4
  },
  "last_event": null,
  "recent_events": []
}
