{
  "schema": 1,
  "seq": 0,
  "written_at": 1791590400000,
  "summary": {
    "state": "error",
    "needs_action": true,
    "line": "eGPU error · the driver is not answering (nvidia-smi hung); log out or reboot"
  },
  "phase": "error",
  "bolt": {
    "present": true,
    "daemon": true,
    "domain": true,
    "uuid": "ba7e8780-0085-dcfa-ffff-ffffffffffff",
    "name": "TBGAA",
    "vendor": "Micro Computer (HK) Tech. Ltd.",
    "status": "authorized",
    "policy": "iommu",
    "stored": true,
    "generation": "USB4",
    "profile": "minisforum-deg2"
  },
  "pci": {
    "present": true,
    "bdf": "0000:03:00.0",
    "functions": [
      "0000:03:00.0",
      "0000:03:00.1"
    ],
    "vendor": "0x10de",
    "device": "0x2783",
    "name": "NVIDIA Corporation AD104 [GeForce RTX 4070 SUPER]",
    "removable": true,
    "link": {
      "speed": "16.0 GT/s PCIe",
      "width": "4",
      "max_speed": "16.0 GT/s PCIe",
      "max_width": "16"
    }
  },
  "backend": {
    "name": "nvidia",
    "supported": true
  },
  "driver": {
    "bound": "nvidia",
    "modules": {
      "nvidia": true,
      "nvidia_modeset": true,
      "nvidia_drm": true,
      "nvidia_uvm": true
    },
    "modeset": true,
    "fbdev": true
  },
  "gpu": {
    "ok": false,
    "name": null,
    "version": null,
    "temp_c": null,
    "util_pct": null,
    "mem_used_mb": null,
    "procs": [],
    "error": "smi_hung",
    "driver": "nvidia",
    "state": "D"
  },
  "drm": {
    "card": "card1",
    "card_bypath": "pci-0000:03:00.0-card",
    "link": null,
    "compositor_has_card": false
  },
  "display": {
    "monitors": [
      {
        "connector": "DP-3",
        "card": "card1",
        "status": "disconnected",
        "enabled": false,
        "in_compositor": false
      },
      {
        "connector": "DP-4",
        "card": "card1",
        "status": "disconnected",
        "enabled": false,
        "in_compositor": false
      },
      {
        "connector": "DP-5",
        "card": "card1",
        "status": "disconnected",
        "enabled": false,
        "in_compositor": false
      },
      {
        "connector": "HDMI-A-2",
        "card": "card1",
        "status": "disconnected",
        "enabled": false,
        "in_compositor": false
      }
    ],
    "needs_relogin": false
  },
  "modules": {
    "held_after_eject": false,
    "held_by": []
  },
  "steam": {
    "running": false
  },
  "hints": [
    {
      "id": "smi_hung",
      "text": "nvidia-smi is stuck in the kernel. Do not unplug; save your work and log out or reboot."
    }
  ],
  "health_summary": {
    "errors": 0,
    "warnings": 1
  },
  "last_event": null,
  "recent_events": []
}
